{"artifact_type":"external_framework_manifest","schema_version":"0.1","framework_id":"open-policy-agent","name":"Open Policy Agent","source_reference":"https://www.openpolicyagent.org/docs/latest/","source_version":"official documentation recorded","allowed_use_boundary":["Use policy decisions as external evidence only.","Do not inherit authority from an allow result."],"claims":["OPA evaluates structured input against policy and produces policy decisions."],"non_claims":["OPA does not prove transition admissibility.","OPA does not grant execution authority."],"transition_table_mapping":{"framework_identity":"Open Policy Agent","source_reference":"https://www.openpolicyagent.org/docs/latest/","source_version":"official documentation recorded","allowed_use_boundary":"policy-decision evidence only","claims":"structured policy evaluation","non_claims":"no admissibility proof or execution authority","input_artifact_type":"structured input and policy","output_artifact_type":"policy decision artifact","actor_or_authority_model":"external policy engine; authority not inherited","evidence_model":"official source plus bounded crosswalk","policy_or_rule_model":"policy rules","delegation_model":"not established by OPA","decision_or_result_model":"policy decision evidence","execution_authority_claim":false,"receipt_or_trace_model":"manifest and report references","reconstruction_model":"source and mapping reconstruct the bounded relationship","SPE_overlap":"policy evidence may inform standing review","StegVerse_ecosystem_overlap":"commitment-boundary policy evidence","fail_closed_conditions":"missing source, mapping, or authority overclaim"},"SPE_overlap":{"standing_boundary":"policy evidence only","authority_evaluation":"performed separately","commit_time_admissibility":"not claimed","receipt_reconstruction":"source-reference bounded"},"StegVerse_ecosystem_overlap":{"transition_table":"policy evidence mapping","chain_status":"source-reviewed crosswalk","documentation_surface":"wiki page","execution_path":"not authorized"},"fail_closed_conditions":["missing source","incomplete mapping","authority overclaim"],"boundary":{"certification_claim":false,"endorsement_claim":false,"execution_authority_claim":false,"commit_time_authority_claim":false,"compatibility_manifest_is_authority":false,"missing_or_partial_fields_fail_closed":true}}