{
  "artifact_type": "external_framework_manifest",
  "schema_version": "0.1",
  "framework_id": "admissible-existence-seed-cycle",
  "name": "Admissible Existence Seed Cycle",
  "source_reference": "Admissible-Existence/AE org-status/admissible-existence-seed-cycle.json",
  "source_version": "seed-cycle-complete",
  "allowed_use_boundary": [
    "Use as an internal StegVerse ecosystem seed-cycle status mirror.",
    "Use as compatibility evidence for transition-table mapping tests.",
    "Do not use as external certification, endorsement, or execution authority."
  ],
  "claims": [
    "A seed-cycle status record exists.",
    "The record can be represented as a framework entry for compatibility testing.",
    "The record can be mapped against transition-table elements."
  ],
  "non_claims": [
    "No external certification is claimed.",
    "No external endorsement is claimed.",
    "No execution authority is claimed.",
    "No commit-time authority is claimed.",
    "No framework-wide validation is claimed."
  ],
  "transition_table_mapping": {
    "framework_identity": "Admissible Existence Seed Cycle",
    "source_reference": "Admissible-Existence/AE org-status/admissible-existence-seed-cycle.json",
    "source_version": "seed-cycle-complete",
    "allowed_use_boundary": "evidence-bounded status mirror only",
    "claims": "seed-cycle status and compatibility-test representation",
    "non_claims": "no certification, endorsement, execution authority, or commit-time authority",
    "input_artifact_type": "source status JSON",
    "output_artifact_type": "external framework manifest and compatibility report",
    "actor_or_authority_model": "StegVerse ecosystem status surface; no independent external authority granted",
    "evidence_model": "source repository plus local mirror record",
    "policy_or_rule_model": "non-authority boundary and fail-closed missing-field behavior",
    "delegation_model": "none asserted",
    "decision_or_result_model": "compatibility evidence only",
    "execution_authority_claim": false,
    "receipt_or_trace_model": "local compatibility report",
    "reconstruction_model": "manifest plus report can be regenerated from registry state",
    "SPE_overlap": "standing-boundary and non-authority comparison",
    "StegVerse_ecosystem_overlap": "status propagation, evidence mirror, transition-table compatibility mapping",
    "fail_closed_conditions": "missing source, undefined overlap, missing transition-table mapping, or authority overclaim"
  },
  "SPE_overlap": {
    "standing_boundary": "overlaps",
    "authority_evaluation": "non-authorizing reference only",
    "commit_time_admissibility": "not claimed",
    "receipt_reconstruction": "partial"
  },
  "StegVerse_ecosystem_overlap": {
    "transition_table": "mapped",
    "chain_status": "status mirror",
    "documentation_surface": "wiki reference",
    "execution_path": "not authorized"
  },
  "fail_closed_conditions": [
    "source reference is missing",
    "source version is missing",
    "allowed-use boundary is missing",
    "claims or non-claims are missing",
    "transition-table mapping is incomplete",
    "SPE overlap is undefined",
    "StegVerse ecosystem overlap is undefined",
    "any certification, endorsement, execution authority, or commit-time authority claim appears"
  ],
  "boundary": {
    "certification_claim": false,
    "endorsement_claim": false,
    "execution_authority_claim": false,
    "commit_time_authority_claim": false,
    "compatibility_manifest_is_authority": false,
    "missing_or_partial_fields_fail_closed": true
  }
}
