{
  "artifact_type": "external_framework_manifest",
  "schema_version": "0.1",
  "framework_id": "elyria-admission-runtime",
  "name": "Elyria Admission Runtime",
  "source_reference": "https://github.com/Kamanaka5502/elyria-admission-runtime/releases/tag/v0.8.2-public",
  "source_version": "v0.8.2-public",
  "allowed_use_boundary": [
    "Use the public buyer-review release and repository as source evidence for Elyria request/response translation and bounded runtime semantics.",
    "Do not infer a callable public runtime endpoint from repository, release, documentation, localhost, container, or source URLs.",
    "Treat Elyria verdicts and receipts as foreign-framework observations; StegVerse authority remains with its own governed path."
  ],
  "claims": [
    "The public release describes a consequence-admission runtime with deterministic verdicting, evidence gates, signed receipts, replay verification, exposure graphing, and proof export.",
    "The public API surface includes POST /movements/assess for movement assessment."
  ],
  "non_claims": [
    "The public release does not establish an independently observed callable owner-operated network endpoint.",
    "Elyria verdicts do not grant StegVerse admission or execution authority.",
    "Source/release verification does not prove authentic two-way StegVerse-to-Elyria transport."
  ],
  "transition_table_mapping": {
    "framework_identity": "Elyria Admission Runtime",
    "source_reference": "https://github.com/Kamanaka5502/elyria-admission-runtime/releases/tag/v0.8.2-public",
    "source_version": "v0.8.2-public",
    "allowed_use_boundary": "foreign consequence-admission observation and receipt evidence only",
    "claims": "movement assessment, deterministic ADMIT/HOLD/REFUSE/NO_PROVABLE_ADMISSION verdicts, signed receipts, replay and no-bind/proof surfaces",
    "non_claims": "no StegVerse standing, transition admission, execution authority, or endpoint availability inherited",
    "input_artifact_type": "Elyria movement-assessment request",
    "output_artifact_type": "Elyria verdict plus foreign signed receipt/replay evidence",
    "actor_or_authority_model": "Elyria evaluates its own movement conditions; authority does not transfer into StegVerse",
    "evidence_model": "public release/repository source plus authentic runtime response evidence when independently observed",
    "policy_or_rule_model": "Elyria authority, standing, evidence, custody and refusal conditions",
    "delegation_model": "must be established separately in StegVerse; not inherited from Elyria",
    "decision_or_result_model": "foreign ADMIT/HOLD/REFUSE/NO_PROVABLE_ADMISSION observation",
    "execution_authority_claim": false,
    "receipt_or_trace_model": "foreign signed receipt, replay checks, no-bind/proof packet surfaces",
    "reconstruction_model": "source plus exact request/response/receipt evidence can reconstruct the bounded foreign observation",
    "SPE_overlap": "foreign standing/evidence observations may enter StegVerse review as evidence",
    "StegVerse_ecosystem_overlap": "external-adapter round trip across existing SDK and Interlock/InTr boundary",
    "fail_closed_conditions": "missing exact identity, unsupported verdict, malformed receipt, unqualified endpoint, missing endpoint evidence, or authority promotion"
  },
  "SPE_overlap": {
    "standing_boundary": "foreign observation only",
    "authority_evaluation": "StegVerse authority evaluated separately",
    "commit_time_admissibility": "not established by Elyria verdict",
    "receipt_reconstruction": "foreign receipt preserved as evidence; Master Records custody remains separate"
  },
  "StegVerse_ecosystem_overlap": {
    "transition_table": "external movement-assessment evidence",
    "chain_status": "source-reviewed adapter crosswalk",
    "documentation_surface": "Admissibility Wiki external-framework page",
    "execution_path": "only through evidence-qualified endpoint binding plus existing Interlock/InTr transport"
  },
  "fail_closed_conditions": [
    "source reference or version is missing",
    "transition-table mapping is incomplete",
    "runtime endpoint is inferred from source or documentation",
    "endpoint evidence is missing or malformed",
    "foreign verdict or receipt is promoted to StegVerse authority",
    "authentic round-trip evidence is claimed without network response and Master Records custody"
  ],
  "boundary": {
    "certification_claim": false,
    "endorsement_claim": false,
    "execution_authority_claim": false,
    "commit_time_authority_claim": false,
    "compatibility_manifest_is_authority": false,
    "missing_or_partial_fields_fail_closed": true
  }
}
