{
  "artifact_type": "external_framework_manifest",
  "schema_version": "0.1",
  "framework_id": "aar",
  "name": "AAR",
  "source_reference": "https://www.resurrection-tech.com/assessment",
  "source_version": "public source recorded",
  "allowed_use_boundary": ["Use as external supervised-AI governance and operational-forensics crosswalk evidence.", "Preserve AAR-native terminology.", "Do not treat as certification, endorsement, execution authority, or commit-time authority."],
  "claims": ["AAR can support observable-system governance and operational-forensics comparison.", "AAR can be mapped against evidence, review, reconstruction, and boundary terms."],
  "non_claims": ["AAR does not prove transition admissibility.", "AAR does not grant execution authority.", "AAR source citation is not acceptance of equivalence."],
  "transition_table_mapping": {"framework_identity":"AAR","source_reference":"https://www.resurrection-tech.com/assessment","source_version":"public source recorded","allowed_use_boundary":"crosswalk evidence only","claims":"observable-system governance, pre-execution cost governance, operational forensics, systemic-risk opacity boundary","non_claims":"no admissibility proof, certification, endorsement, or execution authority","input_artifact_type":"assessment or governance artifact","output_artifact_type":"crosswalk and compatibility evidence","actor_or_authority_model":"external assessment posture; no StegVerse authority inherited","evidence_model":"operational evidence and forensics posture","policy_or_rule_model":"governance before opacity and cost/harm boundary","delegation_model":"not asserted by wiki entry","decision_or_result_model":"comparison evidence only","execution_authority_claim":false,"receipt_or_trace_model":"source reference and wiki record","reconstruction_model":"source plus crosswalk can reconstruct relationship limits","SPE_overlap":"may inform evidence/review posture, not standing determination","StegVerse_ecosystem_overlap":"evidence posture, review posture, reconstructability, boundary conditions","fail_closed_conditions":"missing source, undefined mapping, or authority overclaim"},
  "SPE_overlap": {"standing_boundary":"evidence and review posture only","authority_evaluation":"not performed by AAR","commit_time_admissibility":"not claimed","receipt_reconstruction":"source-reference bounded"},
  "StegVerse_ecosystem_overlap": {"transition_table":"evidence/review/boundary mapping","chain_status":"crosswalk evidence","documentation_surface":"wiki reference","execution_path":"not authorized"},
  "fail_closed_conditions": ["source reference is missing", "source version is missing", "transition-table mapping is incomplete", "SPE overlap is undefined", "any certification, endorsement, execution authority, or commit-time authority claim appears"],
  "boundary": {"certification_claim":false,"endorsement_claim":false,"execution_authority_claim":false,"commit_time_authority_claim":false,"compatibility_manifest_is_authority":false,"missing_or_partial_fields_fail_closed":true}
}
