{"artifact_type":"external_framework_manifest","schema_version":"0.1","framework_id":"oauth2","name":"OAuth 2.0","source_reference":"https://www.rfc-editor.org/rfc/rfc6749","source_version":"RFC 6749 recorded","allowed_use_boundary":["Use grants, scopes, and tokens as delegation evidence only."],"claims":["OAuth 2.0 enables limited access to protected resources."],"non_claims":["Delegated access is not universal authority.","Token validity is not transition admissibility."],"transition_table_mapping":{"framework_identity":"OAuth 2.0","source_reference":"https://www.rfc-editor.org/rfc/rfc6749","source_version":"RFC 6749 recorded","allowed_use_boundary":"delegation and scope evidence only","claims":"limited delegated resource access","non_claims":"no universal authority or commit-time admissibility","input_artifact_type":"authorization grant and token request","output_artifact_type":"scoped access token evidence","actor_or_authority_model":"resource owner and client context","evidence_model":"official RFC plus bounded crosswalk","policy_or_rule_model":"grant and scope rules","delegation_model":"scoped delegation evidence","decision_or_result_model":"token issuance or validation evidence","execution_authority_claim":false,"receipt_or_trace_model":"grant, token, and manifest references","reconstruction_model":"scope and token context support delegation reconstruction","SPE_overlap":"delegation evidence may inform standing review","StegVerse_ecosystem_overlap":"authority, scope, and commitment boundary","fail_closed_conditions":"missing source, scope, actor context, mapping, or authority overclaim"},"SPE_overlap":{"standing_boundary":"delegation evidence only","authority_evaluation":"performed separately","commit_time_admissibility":"not claimed","receipt_reconstruction":"source-reference bounded"},"StegVerse_ecosystem_overlap":{"transition_table":"delegation evidence mapping","chain_status":"source-reviewed crosswalk","documentation_surface":"wiki page","execution_path":"not authorized"},"fail_closed_conditions":["missing source","incomplete mapping","authority overclaim"],"boundary":{"certification_claim":false,"endorsement_claim":false,"execution_authority_claim":false,"commit_time_authority_claim":false,"compatibility_manifest_is_authority":false,"missing_or_partial_fields_fail_closed":true}}