{"artifact_type":"external_framework_manifest","schema_version":"0.1","framework_id":"w3c-prov","name":"W3C PROV","source_reference":"https://www.w3.org/TR/prov-overview/","source_version":"W3C Recommendation recorded","allowed_use_boundary":["Use provenance entities, activities, agents, and derivations as reconstruction evidence only."],"claims":["W3C PROV represents entities, activities, agents, usage, generation, derivation, and attribution."],"non_claims":["Provenance is not permission.","A reconstructable chain is not automatically admissible."],"transition_table_mapping":{"framework_identity":"W3C PROV","source_reference":"https://www.w3.org/TR/prov-overview/","source_version":"W3C Recommendation recorded","allowed_use_boundary":"provenance evidence only","claims":"entities, activities, agents, derivation, and attribution","non_claims":"no legitimacy, delegation, or execution authority","input_artifact_type":"PROV record","output_artifact_type":"provenance reconstruction evidence","actor_or_authority_model":"agent attribution evidence only","evidence_model":"official recommendation plus bounded crosswalk","policy_or_rule_model":"PROV model constraints","delegation_model":"not established","decision_or_result_model":"provenance evidence","execution_authority_claim":false,"receipt_or_trace_model":"PROV record and manifest references","reconstruction_model":"PROV relationships support derivation reconstruction","SPE_overlap":"provenance may inform evidence review","StegVerse_ecosystem_overlap":"reconstruction and freshness boundary","fail_closed_conditions":"missing source, context, mapping, or authority overclaim"},"SPE_overlap":{"standing_boundary":"provenance evidence only","authority_evaluation":"performed separately","commit_time_admissibility":"not claimed","receipt_reconstruction":"source-reference bounded"},"StegVerse_ecosystem_overlap":{"transition_table":"provenance evidence mapping","chain_status":"source-reviewed crosswalk","documentation_surface":"wiki page","execution_path":"not authorized"},"fail_closed_conditions":["missing source","incomplete mapping","authority overclaim"],"boundary":{"certification_claim":false,"endorsement_claim":false,"execution_authority_claim":false,"commit_time_authority_claim":false,"compatibility_manifest_is_authority":false,"missing_or_partial_fields_fail_closed":true}}