{
  "artifact_type": "external_framework_manifest",
  "schema_version": "0.1",
  "framework_id": "evide",
  "name": "EVIDE",
  "source_reference": "https://www.certifywebcontent.com/supervised-ai/evidentiary-deposit/",
  "source_version": "public source recorded",
  "allowed_use_boundary": ["Use as external post-event evidence and reconstructability crosswalk evidence.", "Preserve EVIDE-native terminology.", "Do not treat as certification, endorsement, execution authority, or commit-time authority."],
  "claims": ["EVIDE can preserve or organize evidence after an event or decision.", "EVIDE can support reconstruction and dispute review."],
  "non_claims": ["EVIDE does not prove transition admissibility.", "EVIDE does not grant execution authority.", "Post-event evidence does not prove commit-time standing."],
  "transition_table_mapping": {"framework_identity":"EVIDE","source_reference":"https://www.certifywebcontent.com/supervised-ai/evidentiary-deposit/","source_version":"public source recorded","allowed_use_boundary":"post-event evidentiary reconstructability evidence only","claims":"evidence preservation, event reconstruction, dispute support","non_claims":"no admissibility proof, runtime enforcement, or execution authority","input_artifact_type":"evidentiary deposit or registry artifact","output_artifact_type":"crosswalk and compatibility evidence","actor_or_authority_model":"external evidence registry posture; no StegVerse authority inherited","evidence_model":"post-event evidence records","policy_or_rule_model":"evidence-bound reconstruction and challenge boundary","delegation_model":"not asserted by wiki entry","decision_or_result_model":"post-event evidence only","execution_authority_claim":false,"receipt_or_trace_model":"evidence deposit reference and wiki record","reconstruction_model":"source plus crosswalk can reconstruct evidence posture and limits","SPE_overlap":"evidence may inform standing review but cannot replace it","StegVerse_ecosystem_overlap":"receipt-bound execution and reconstructability comparison","fail_closed_conditions":"missing evidence, undefined mapping, or authority overclaim"},
  "SPE_overlap": {"standing_boundary":"post-event evidence only","authority_evaluation":"not performed by EVIDE","commit_time_admissibility":"not claimed","receipt_reconstruction":"evidence-reference bounded"},
  "StegVerse_ecosystem_overlap": {"transition_table":"evidence and reconstruction mapping","chain_status":"crosswalk evidence","documentation_surface":"wiki reference","execution_path":"not authorized"},
  "fail_closed_conditions": ["source reference is missing", "source version is missing", "transition-table mapping is incomplete", "SPE overlap is undefined", "any certification, endorsement, execution authority, or commit-time authority claim appears"],
  "boundary": {"certification_claim":false,"endorsement_claim":false,"execution_authority_claim":false,"commit_time_authority_claim":false,"compatibility_manifest_is_authority":false,"missing_or_partial_fields_fail_closed":true}
}
