{
  "artifact_type": "external_framework_manifest",
  "schema_version": "0.1",
  "framework_id": "decision-authority",
  "name": "Decision Authority Compatibility",
  "source_reference": "StegVerse-Labs/repo-standards/schemas/decision-authority.schema.json",
  "source_version": "canonical schema merged in repo-standards",
  "allowed_use_boundary": [
    "Use as compatibility evidence for mapping public wiki decision vocabulary to ST-004 authority values.",
    "Do not treat as certification, endorsement, execution authority, or commit-time authority."
  ],
  "claims": [
    "The repo-standards decision-authority schema defines canonical ST-004 authority values.",
    "Wiki public vocabulary can be mapped into those values for explanatory consistency."
  ],
  "non_claims": [
    "This mapping does not grant execution authority.",
    "This mapping does not prove admissibility.",
    "This mapping does not replace policy, delegation, evidence, or validation."
  ],
  "transition_table_mapping": {
    "framework_identity": "Decision Authority Compatibility",
    "source_reference": "StegVerse-Labs/repo-standards/schemas/decision-authority.schema.json",
    "source_version": "canonical schema merged in repo-standards",
    "allowed_use_boundary": "compatibility evidence only",
    "claims": "public wiki values map to canonical ST-004 authority values",
    "non_claims": "no execution authority, admissibility proof, or commit-time standing",
    "input_artifact_type": "public vocabulary value",
    "output_artifact_type": "mapped ST-004 authority value",
    "actor_or_authority_model": "repo-standards defines canonical vocabulary; wiki records public compatibility only",
    "evidence_model": "source schema reference plus local compatibility record",
    "policy_or_rule_model": "ST-004 transition table authority vocabulary",
    "delegation_model": "not asserted by wiki entry",
    "decision_or_result_model": "ALLOW to allowed; DENY to denied; FAIL-CLOSED to fail-closed",
    "execution_authority_claim": false,
    "receipt_or_trace_model": "manifest reference and compatibility report",
    "reconstruction_model": "source schema plus wiki mapping reconstruct the vocabulary relationship",
    "SPE_overlap": "authority vocabulary can support standing review but does not create standing",
    "StegVerse_ecosystem_overlap": "decision vocabulary reconciliation across repo-standards and wiki public doctrine",
    "fail_closed_conditions": "missing canonical schema, unmapped value, or authority overclaim"
  },
  "SPE_overlap": {
    "standing_boundary": "vocabulary compatibility only",
    "authority_evaluation": "not performed by this manifest",
    "commit_time_admissibility": "not claimed",
    "receipt_reconstruction": "source-reference bounded"
  },
  "StegVerse_ecosystem_overlap": {
    "transition_table": "ST-004 decision authority vocabulary mapping",
    "chain_status": "compatibility evidence",
    "documentation_surface": "wiki reference",
    "execution_path": "not authorized"
  },
  "fail_closed_conditions": [
    "canonical schema is missing",
    "local decision value is unmapped",
    "transition-table mapping is incomplete",
    "SPE overlap is undefined",
    "any certification, endorsement, execution authority, or commit-time authority claim appears"
  ],
  "boundary": {
    "certification_claim": false,
    "endorsement_claim": false,
    "execution_authority_claim": false,
    "commit_time_authority_claim": false,
    "compatibility_manifest_is_authority": false,
    "missing_or_partial_fields_fail_closed": true
  }
}
