{"artifact_type":"external_framework_manifest","schema_version":"0.1","framework_id":"sigstore","name":"Sigstore","source_reference":"https://docs.sigstore.dev/","source_version":"official documentation recorded","allowed_use_boundary":["Use signatures, certificates, and transparency records as integrity evidence only."],"claims":["Sigstore provides identity-bound signing, verification, and transparency logging."],"non_claims":["Signature verification is not transition admissibility.","Transparency inclusion is not execution authority."],"transition_table_mapping":{"framework_identity":"Sigstore","source_reference":"https://docs.sigstore.dev/","source_version":"official documentation recorded","allowed_use_boundary":"integrity and origin evidence only","claims":"identity-bound signing and transparency logging","non_claims":"no current delegation or execution authority","input_artifact_type":"signed software artifact","output_artifact_type":"verification and transparency evidence","actor_or_authority_model":"signer identity evidence only","evidence_model":"official source plus bounded crosswalk","policy_or_rule_model":"verification policy","delegation_model":"not established","decision_or_result_model":"signature verification evidence","execution_authority_claim":false,"receipt_or_trace_model":"certificate and transparency references","reconstruction_model":"signatures and logs support origin reconstruction","SPE_overlap":"integrity evidence may inform standing review","StegVerse_ecosystem_overlap":"origin, integrity, and reconstruction boundary","fail_closed_conditions":"missing source, verification evidence, mapping, or authority overclaim"},"SPE_overlap":{"standing_boundary":"integrity evidence only","authority_evaluation":"performed separately","commit_time_admissibility":"not claimed","receipt_reconstruction":"source-reference bounded"},"StegVerse_ecosystem_overlap":{"transition_table":"integrity evidence mapping","chain_status":"source-reviewed crosswalk","documentation_surface":"wiki page","execution_path":"not authorized"},"fail_closed_conditions":["missing source","incomplete mapping","authority overclaim"],"boundary":{"certification_claim":false,"endorsement_claim":false,"execution_authority_claim":false,"commit_time_authority_claim":false,"compatibility_manifest_is_authority":false,"missing_or_partial_fields_fail_closed":true}}