{
  "artifact_type": "external_framework_manifest",
  "schema_version": "0.1",
  "framework_id": "care-runtime",
  "name": "CARE Runtime",
  "source_reference": "screenshot supplied by user; official public source URL required",
  "source_version": "UNVERIFIED_SOURCE_REQUIRED",
  "allowed_use_boundary": [
    "Use only as provisional intake evidence.",
    "Do not treat as an official framework source until a public source URL or source artifact is recorded.",
    "Do not use as certification, endorsement, execution authority, or commit-time authority."
  ],
  "claims": [
    "A provisional framework entry exists in the external-frameworks index.",
    "The entry can be represented as source-blocked intake state.",
    "The entry can be tested for fail-closed behavior when official source evidence is missing."
  ],
  "non_claims": [
    "No official source verification is claimed.",
    "No external certification is claimed.",
    "No external endorsement is claimed.",
    "No execution authority is claimed.",
    "No commit-time authority is claimed.",
    "No framework-wide validation is claimed."
  ],
  "transition_table_mapping": {
    "framework_identity": "CARE Runtime",
    "source_reference": "screenshot supplied by user; official public source URL required",
    "source_version": "UNVERIFIED_SOURCE_REQUIRED",
    "allowed_use_boundary": "provisional intake evidence only",
    "claims": "source-blocked intake representation",
    "non_claims": "no official source verification, certification, endorsement, execution authority, or commit-time authority",
    "input_artifact_type": "screenshot-derived provisional intake record",
    "output_artifact_type": "source-blocked external framework manifest and compatibility report",
    "actor_or_authority_model": "unknown until official source is provided",
    "evidence_model": "provisional user-supplied screenshot context; official source missing",
    "policy_or_rule_model": "missing official source fails closed",
    "delegation_model": "unknown until official source is provided",
    "decision_or_result_model": "blocked compatibility evidence only",
    "execution_authority_claim": false,
    "receipt_or_trace_model": "local source-blocked compatibility report",
    "reconstruction_model": "provisional manifest plus report can reconstruct why testing is blocked",
    "SPE_overlap": "fail-closed source sufficiency boundary",
    "StegVerse_ecosystem_overlap": "intake, source sufficiency, transition-table blocking behavior",
    "fail_closed_conditions": "official source missing, source version missing, undefined overlap, authority overclaim"
  },
  "SPE_overlap": {
    "standing_boundary": "source insufficient",
    "authority_evaluation": "blocked; no official source",
    "commit_time_admissibility": "not claimed",
    "receipt_reconstruction": "blocked-state reconstructable"
  },
  "StegVerse_ecosystem_overlap": {
    "transition_table": "blocked by source sufficiency",
    "chain_status": "provisional intake only",
    "documentation_surface": "wiki reference requires source upgrade before compatibility cycle completion",
    "execution_path": "not authorized"
  },
  "fail_closed_conditions": [
    "official source reference is missing",
    "official source version is missing",
    "allowed-use boundary cannot be confirmed from official source",
    "claims or non-claims cannot be confirmed from official source",
    "transition-table mapping remains provisional",
    "SPE overlap remains source-insufficient",
    "StegVerse ecosystem overlap remains source-insufficient",
    "any certification, endorsement, execution authority, or commit-time authority claim appears"
  ],
  "boundary": {
    "certification_claim": false,
    "endorsement_claim": false,
    "execution_authority_claim": false,
    "commit_time_authority_claim": false,
    "compatibility_manifest_is_authority": false,
    "missing_or_partial_fields_fail_closed": true,
    "official_source_required_for_completion": true
  }
}
