{
  "artifact_type": "external_framework_manifest",
  "schema_version": "0.1",
  "framework_id": "llama-guard",
  "name": "Llama Guard",
  "source_reference": "https://ollama.com/library/llama-guard3",
  "source_version": "distribution source recorded; canonical governance package not established",
  "allowed_use_boundary": ["Use as safety-classification model distribution crosswalk evidence.", "Preserve the limitation that the recorded source is a distribution page, not a complete canonical model-governance record."],
  "claims": ["Llama Guard is presented as a safety-classification model family for classifying model inputs and outputs against a safety taxonomy."],
  "non_claims": ["Llama Guard output does not establish execution authority.", "The recorded distribution page does not establish complete model provenance or governance coverage.", "A classifier result does not prove transition admissibility or certification."],
  "transition_table_mapping": {"framework_identity":"Llama Guard","source_reference":"https://ollama.com/library/llama-guard3","source_version":"distribution source recorded; canonical governance package not established","allowed_use_boundary":"safety-category evidence only","claims":"classification of model inputs and outputs against a safety taxonomy","non_claims":"no complete provenance, policy authority, standing, certification, or execution authority","input_artifact_type":"model input, output, taxonomy, prompt template, threshold, and runtime configuration","output_artifact_type":"safety classification evidence","actor_or_authority_model":"model distribution and runtime identity; authority not established","evidence_model":"distribution source plus local bounded crosswalk","policy_or_rule_model":"taxonomy and classifier behavior dependent on version and configuration","delegation_model":"not established by classifier result","decision_or_result_model":"safety category or classifier result only","execution_authority_claim":false,"receipt_or_trace_model":"captured classifier inputs, outputs, configuration, and local compatibility record","reconstruction_model":"exact model, prompt, taxonomy, threshold, runtime, and output required","SPE_overlap":"classifier evidence may inform safety review","StegVerse_ecosystem_overlap":"execution-boundary and semantic review evidence","fail_closed_conditions":"missing exact model version, prompt template, taxonomy, threshold, runtime, raw output, or authority overclaim"},
  "SPE_overlap": {"standing_boundary":"classifier evidence only","authority_evaluation":"not performed by Llama Guard","commit_time_admissibility":"not claimed","receipt_reconstruction":"exact fixture and runtime required"},
  "StegVerse_ecosystem_overlap": {"transition_table":"safety evidence mapping","chain_status":"source-reviewed with distribution-source limitation","documentation_surface":"wiki framework page","execution_path":"not authorized"},
  "fail_closed_conditions": ["canonical model or distribution version is missing", "taxonomy, prompt, threshold, or runtime is absent", "classifier behavior is generalized without fixtures", "comparative behavior is claimed without executable evidence"],
  "boundary": {"certification_claim":false,"endorsement_claim":false,"execution_authority_claim":false,"commit_time_authority_claim":false,"compatibility_manifest_is_authority":false,"missing_or_partial_fields_fail_closed":true}
}
