{"artifact_type":"external_framework_manifest","schema_version":"0.1","framework_id":"w3c-did","name":"W3C Decentralized Identifiers","source_reference":"https://w3c.github.io/did/","source_version":"DID Core editor draft recorded","allowed_use_boundary":["Use DID documents and verification methods as identity or control evidence only."],"claims":["DIDs define identifiers, verification methods, services, and controller relationships."],"non_claims":["Identifier control is not execution authority.","Resolution success is not transition admissibility."],"transition_table_mapping":{"framework_identity":"W3C Decentralized Identifiers","source_reference":"https://w3c.github.io/did/","source_version":"DID Core editor draft recorded","allowed_use_boundary":"identifier and control evidence only","claims":"decentralized identifiers and DID documents","non_claims":"no delegation or execution authority","input_artifact_type":"DID and DID document","output_artifact_type":"resolved identity and control evidence","actor_or_authority_model":"controller relationship evidence only","evidence_model":"official draft source plus bounded crosswalk","policy_or_rule_model":"DID method and verification rules","delegation_model":"not established","decision_or_result_model":"resolution and verification evidence","execution_authority_claim":false,"receipt_or_trace_model":"DID document and manifest references","reconstruction_model":"DID documents support identity and control reconstruction","SPE_overlap":"identity evidence may inform standing review","StegVerse_ecosystem_overlap":"authority, freshness, and reconstruction boundary","fail_closed_conditions":"missing source status, resolution context, mapping, or authority overclaim"},"SPE_overlap":{"standing_boundary":"identifier evidence only","authority_evaluation":"performed separately","commit_time_admissibility":"not claimed","receipt_reconstruction":"source-reference bounded"},"StegVerse_ecosystem_overlap":{"transition_table":"identifier evidence mapping","chain_status":"source-reviewed crosswalk","documentation_surface":"wiki page","execution_path":"not authorized"},"fail_closed_conditions":["missing source","incomplete mapping","authority overclaim"],"boundary":{"certification_claim":false,"endorsement_claim":false,"execution_authority_claim":false,"commit_time_authority_claim":false,"compatibility_manifest_is_authority":false,"missing_or_partial_fields_fail_closed":true}}