{
  "artifact_type": "external_framework_manifest",
  "schema_version": "0.1",
  "framework_id": "guardrails-ai",
  "name": "Guardrails AI",
  "source_reference": "https://guardrailsai.com/",
  "source_version": "official project source recorded",
  "allowed_use_boundary": ["Use as model input/output validation and correction crosswalk evidence.", "Do not treat a validator pass or block as execution authority or certification."],
  "claims": ["Guardrails AI provides programmable validators and guardrails for validating, constraining, and correcting model inputs and outputs."],
  "non_claims": ["Guardrails AI does not prove policy legitimacy.", "A validator pass does not establish actor authority or commit-time standing.", "A guardrail block is not StegVerse certification."],
  "transition_table_mapping": {"framework_identity":"Guardrails AI","source_reference":"https://guardrailsai.com/","source_version":"official project source recorded","allowed_use_boundary":"runtime and output-validation evidence only","claims":"programmable validation, constraint, and correction of model inputs and outputs","non_claims":"no policy legitimacy, standing, certification, or execution authority","input_artifact_type":"model input, output, validator configuration, or guardrail configuration","output_artifact_type":"validation, correction, or block evidence","actor_or_authority_model":"configured runtime actors; authority not established by validator result","evidence_model":"official project source plus local bounded crosswalk","policy_or_rule_model":"configured validators and rails","delegation_model":"not established by validation result","decision_or_result_model":"pass, fail, correction, or block evidence only","execution_authority_claim":false,"receipt_or_trace_model":"validator output and local compatibility record","reconstruction_model":"configuration and output may reconstruct bounded guardrail behavior","SPE_overlap":"guardrail evidence may inform standing and policy review","StegVerse_ecosystem_overlap":"preparation, execution-boundary, and semantic review evidence","fail_closed_conditions":"missing configuration, unknown validator coverage, missing runtime context, or authority overclaim"},
  "SPE_overlap": {"standing_boundary":"validation evidence only","authority_evaluation":"not performed by Guardrails AI","commit_time_admissibility":"not claimed","receipt_reconstruction":"configuration and result bounded"},
  "StegVerse_ecosystem_overlap": {"transition_table":"guardrail evidence mapping","chain_status":"source-reviewed crosswalk","documentation_surface":"wiki framework page","execution_path":"not authorized"},
  "fail_closed_conditions": ["source reference or version is missing", "validator or rail configuration is absent", "behavior is generalized beyond observed configuration", "comparative behavior is claimed without executable evidence"],
  "boundary": {"certification_claim":false,"endorsement_claim":false,"execution_authority_claim":false,"commit_time_authority_claim":false,"compatibility_manifest_is_authority":false,"missing_or_partial_fields_fail_closed":true}
}
